{"artifacts":[],"base_revision":0,"diagnostics":[{"actual":null,"base_revision":0,"cause":"capability declaration has no identical trusted host injection","code":"E_CAPABILITY_MISSING","diagnostic_id":"diag_834f0ad3f16bbaec","entity_id":"greeting.listen","expected":null,"related_entities":[],"retryable":true,"severity":"error","stage":"capability_check","suggested_operations":[]},{"actual":null,"base_revision":0,"cause":"capability declaration has no identical trusted host injection","code":"E_CAPABILITY_MISSING","diagnostic_id":"diag_14e0ffb404aa2bf9","entity_id":"greeting.clock","expected":null,"related_entities":[],"retryable":true,"severity":"error","stage":"capability_check","suggested_operations":[]},{"actual":null,"base_revision":0,"cause":"runtime call must explicitly select its required trusted host capability","code":"E_CAPABILITY_MISSING","diagnostic_id":"diag_b1d0c642f187917a","entity_id":"greeting.connection.new_r0_817.new_r0_821.arm.0.new_r0_823","expected":null,"related_entities":[],"retryable":true,"severity":"error","stage":"capability_check","suggested_operations":[]},{"actual":null,"base_revision":0,"cause":"runtime call must explicitly select its required trusted host capability","code":"E_CAPABILITY_MISSING","diagnostic_id":"diag_99d3305b56dd8d66","entity_id":"greeting.serve.new_r0_837.new_r0_838","expected":null,"related_entities":[],"retryable":true,"severity":"error","stage":"capability_check","suggested_operations":[]}],"evidence_id":null,"ok":false,"result":{"candidate":".il/experiments/dc9e7bb8546b8bdc36e7d0989567152c9f3681d10d5c784aa71e0b9ea639e5d5","graph_hash":"sha256:9acfb17678c64cf33d5a4e86ad9ef5aff5560a9cc90a482c0808b962ed1a9a05","revision":0,"run_id":"run_577fb3c3b9d9a7ee6e8bd12048f10cf73489bc912b699fe34b90f54835f33659"},"result_revision":0,"tool":"transact","tool_version":"1.0.0"}
